{
  "url" : "https://github.com/iris-connect/iris-client/pull/602",
  "project" : "iris-client",
  "projectOrganisation" : "iris-connect",
  "breakingCommit" : "c67872a8d5fe126642b2347bf38e22a1534845e7",
  "prAuthor" : "bot",
  "preCommitAuthor" : "human",
  "breakingCommitAuthor" : "bot",
  "updatedDependency" : {
    "dependencyGroupID" : "org.springdoc",
    "dependencyArtifactID" : "springdoc-openapi-ui",
    "previousVersion" : "1.6.5",
    "newVersion" : "1.6.6",
    "dependencyScope" : "compile",
    "versionUpdateType" : "patch"
  },
  "javaVersionUsedForReproduction" : "11",
  "licenseInfo" : "AGPL-3.0"
}