{
  "url" : "https://github.com/aws/aws-encryption-sdk-java/pull/1421",
  "project" : "aws-encryption-sdk-java",
  "projectOrganisation" : "aws",
  "breakingCommit" : "3cb9e27d49e1ed46c0b6511103a0c495e031c362",
  "prAuthor" : "bot",
  "preCommitAuthor" : "bot",
  "breakingCommitAuthor" : "bot",
  "updatedDependency" : {
    "dependencyGroupID" : "com.amazonaws",
    "dependencyArtifactID" : "aws-java-sdk",
    "previousVersion" : "1.12.394",
    "newVersion" : "1.12.417",
    "dependencyScope" : "compile",
    "versionUpdateType" : "patch"
  },
  "javaVersionUsedForReproduction" : "11",
  "licenseInfo" : "Apache-2.0"
}