{
  "url" : "https://github.com/sceiler/Java-TestNG-Appium-Selenium/pull/135",
  "project" : "Java-TestNG-Appium-Selenium",
  "projectOrganisation" : "sceiler",
  "breakingCommit" : "e143f486fcacef7f5d0602b943ae71b279024856",
  "prAuthor" : "bot",
  "preCommitAuthor" : "human",
  "breakingCommitAuthor" : "bot",
  "updatedDependency" : {
    "dependencyGroupID" : "io.netty",
    "dependencyArtifactID" : "netty-all",
    "previousVersion" : "4.1.89.Final",
    "newVersion" : "4.1.90.Final",
    "dependencyScope" : "compile",
    "versionUpdateType" : "other"
  },
  "javaVersionUsedForReproduction" : "11",
  "licenseInfo" : "No license found"
}