{
  "url" : "https://github.com/keycloak/keycloak/pull/11014",
  "project" : "keycloak",
  "projectOrganisation" : "keycloak",
  "breakingCommit" : "9875a788f047e1f5cfe29ef55986f1397fa1bd3f",
  "prAuthor" : "human",
  "preCommitAuthor" : "human",
  "breakingCommitAuthor" : "human",
  "updatedDependency" : {
    "dependencyGroupID" : "org.keycloak",
    "dependencyArtifactID" : "keycloak-admin-ui",
    "previousVersion" : "999-SNAPSHOT",
    "newVersion" : "${project.version}",
    "dependencyScope" : "compile",
    "versionUpdateType" : "other"
  },
  "javaVersionUsedForReproduction" : "11",
  "licenseInfo" : "Apache-2.0"
}