{
  "url" : "https://github.com/gruelbox/transaction-outbox/pull/350",
  "project" : "transaction-outbox",
  "projectOrganisation" : "gruelbox",
  "breakingCommit" : "92771cd3dab0f336407b0e6a9ae328880e8cddcd",
  "prAuthor" : "bot",
  "preCommitAuthor" : "bot",
  "breakingCommitAuthor" : "bot",
  "updatedDependency" : {
    "dependencyGroupID" : "org.jooq",
    "dependencyArtifactID" : "jooq",
    "previousVersion" : "3.16.5",
    "newVersion" : "3.17.5",
    "dependencyScope" : "compile",
    "versionUpdateType" : "minor"
  },
  "javaVersionUsedForReproduction" : "11",
  "licenseInfo" : "Apache-2.0"
}