{
  "url" : "https://github.com/pinterest/orion/pull/126",
  "project" : "orion",
  "projectOrganisation" : "pinterest",
  "breakingCommit" : "97309132df571edacc69dda4b9b614385d2122d3",
  "prAuthor" : "bot",
  "preCommitAuthor" : "human",
  "breakingCommitAuthor" : "bot",
  "updatedDependency" : {
    "dependencyGroupID" : "com.fasterxml.jackson.core",
    "dependencyArtifactID" : "jackson-databind",
    "previousVersion" : "2.9.10.7",
    "newVersion" : "2.13.4.1",
    "dependencyScope" : "compile",
    "versionUpdateType" : "other"
  },
  "javaVersionUsedForReproduction" : "11",
  "licenseInfo" : "Apache-2.0"
}