{
  "url" : "https://github.com/Jikoo/Regionerator/pull/104",
  "project" : "Regionerator",
  "projectOrganisation" : "Jikoo",
  "breakingCommit" : "1a0429f752cd076ed47dae982851c87fc03acb37",
  "prAuthor" : "bot",
  "preCommitAuthor" : "bot",
  "breakingCommitAuthor" : "bot",
  "updatedDependency" : {
    "dependencyGroupID" : "com.github.elBukkit",
    "dependencyArtifactID" : "PreciousStones",
    "previousVersion" : "1.16.5",
    "newVersion" : "1.17.2",
    "dependencyScope" : "provided",
    "versionUpdateType" : "minor"
  },
  "javaVersionUsedForReproduction" : "11",
  "licenseInfo" : "CC-BY-SA-4.0"
}